"Status","Start Time","Stop Time","Duration in ms","Parent Suite","Suite","Sub Suite","Test Class","Test Method","Name","Description"
"failed","Mon Nov 03 03:55:30 UTC 2025","Mon Nov 03 03:55:30 UTC 2025","249","","tests.ProductTest","","tests.ProductTest","deveBuscarProdutoEspecificoPorId","deveBuscarProdutoEspecificoPorId()","CT-03-Deve buscar um produto específico pelo ID (ID 4) e validar todo o seu corpo."
"failed","Mon Nov 03 03:55:30 UTC 2025","Mon Nov 03 03:55:30 UTC 2025","255","","tests.ProductTest","","tests.ProductTest","deveAtualizarPrecoDoProduto","deveAtualizarPrecoDoProduto()","CT-04-Deve atualizar o preço de um produto específico (ID 4) com sucesso."
"failed","Mon Nov 03 03:55:29 UTC 2025","Mon Nov 03 03:55:30 UTC 2025","317","","tests.ProductTest","","tests.ProductTest","deveExcluirProduto","deveExcluirProduto()","CT-05-Deve excluir um produto específico (ID 4) com sucesso."
"passed","Mon Nov 03 03:55:26 UTC 2025","Mon Nov 03 03:55:29 UTC 2025","2986","","tests.ProductTest","","tests.ProductTest","deveCriarNovoProdutoComSucesso","deveCriarNovoProdutoComSucesso()","CT-01-Deve criar um novo produto com sucesso"
"failed","Mon Nov 03 03:55:30 UTC 2025","Mon Nov 03 03:55:31 UTC 2025","466","","tests.ProductTest","","tests.ProductTest","deveBuscarProdutosComSucesso","deveBuscarProdutosComSucesso()","CT-02-Deve buscar a lista completa de produtos e validar um item específico (ID 4) na lista."
